{
  "budgets": {
    "maxCostUsd": "1.00",
    "maxToolCalls": 20,
    "maxWallClockMinutes": 5
  },
  "decodingParameters": {
    "temperature": 0
  },
  "evaluatorIdentity": "opaque:tutorial-evaluator",
  "judgeConfiguration": null,
  "modelSnapshot": "tutorial-deterministic-evaluator",
  "parentDigest": null,
  "permissionInventory": [],
  "revisionCount": 0,
  "schemaVersion": 1,
  "sealedBriefDigest": "sha256:43c013d51600453c810000c71f50b3edfdc4269f82354dbd2c4c825c4e291b63",
  "seed": 1,
  "systemPromptDigest": "sha256:e2623f778b36d098c63a4b21afdc3f796234b23b62c8ddfdb34a356286862956",
  "toolInventory": []
}
